{
  "usd_per_spectrue_credit": 0.01,
  "tavily_usd_per_credit": 0.005,
  "tavily_usd_multiplier": 1.0,
  "llm_safety_multiplier": 1.2,
  "rounding": "ceil",
  "min_delta_to_show": 5,
  "emit_cost_deltas": false,
  "llm_prices": {
    "gpt-5.6-luna": {
      "usd_per_input_token": 0.0000002,
      "usd_per_output_token": 0.0000012,
      "usd_per_reasoning_token": 0.0000012
    },
    "gpt-5.6-terra": {
      "usd_per_input_token": 0.000002,
      "usd_per_output_token": 0.000012,
      "usd_per_reasoning_token": 0.000012
    },
    "gpt-5.6-sol": {
      "usd_per_input_token": 0.000005,
      "usd_per_output_token": 0.00003,
      "usd_per_reasoning_token": 0.00003
    },
    "gpt-6-luna-decisions": {
      "usd_per_input_token": 0.0000001,
      "usd_per_output_token": 0,
      "usd_per_reasoning_token": null
    },
    "deepseek-v4-flash": {
      "usd_per_input_token": 0.00000014,
      "usd_per_output_token": 0.00000028,
      "usd_per_reasoning_token": null
    },
    "deepseek-v4-pro": {
      "usd_per_input_token": 0.000000435,
      "usd_per_output_token": 0.00000087,
      "usd_per_reasoning_token": 0.00000087
    },
    "text-embedding-3-small": {
      "usd_per_input_token": 0.00000002,
      "usd_per_output_token": 0,
      "usd_per_reasoning_token": null
    },
    "gpt-5-nano": {
      "usd_per_input_token": 0.00000005,
      "usd_per_output_token": 0.0000004,
      "usd_per_reasoning_token": null
    },
    "gpt-5-mini": {
      "usd_per_input_token": 0.00000025,
      "usd_per_output_token": 0.000002,
      "usd_per_reasoning_token": null
    },
    "gpt-5.2": {
      "usd_per_input_token": 0.00000125,
      "usd_per_output_token": 0.00001,
      "usd_per_reasoning_token": 0.00001
    }
  }
}